{
  "air_version": "1.1",
  "spec": "https://agentpk.io/specs/air/v1.1",
  "agent_id": "healthcare-agent-strict-redaction",
  "certificate_id": null,
  "issuing_platform": "nomotic",
  "issuing_platform_version": "0.9.0",
  "export_timestamp": "2026-04-12T00:00:00Z",
  "components": ["fingerprint", "org_context", "compliance_state"],
  "component_hashes": {
    "fingerprint": "sha256:placeholder-recomputed-at-pack-time",
    "org_context": "sha256:placeholder-recomputed-at-pack-time",
    "compliance_state": "sha256:placeholder-recomputed-at-pack-time"
  },
  "export_sig": null,
  "redaction_profile": "strict",
  "intelligence_license": {
    "default": "proprietary",
    "permitted_uses": ["rehydration"],
    "prohibited_uses": ["fine-tuning", "benchmarking", "re-export", "research"]
  },
  "layer_summary": {
    "governance_record": true,
    "institutional_context": true,
    "operational_intelligence": false
  }
}
